Annotator_0_Cat|Annotator_1_Cat|Annotator_2_Cat|0_1_Cat_Agr|0_2_Cat_Agr|1_2_Cat_Agr|2/3-Agreem|3/3-Agreem|Int_Ext_Agr|id|sentence/context - better?
Procedural|0|Procedural|FALSE|TRUE|FALSE|TRUE|FALSE|TRUE|268|Nonetheless, it is sometimes suggested that Nozickâs argument is essentially  concerned with the violation of property rights or with theft, rather than with forced  labor in that Nozick presupposes that one has a property right in the portion of oneâs  earnings the state takes in taxes, a right his critics claim he fails to establish (Kymlicka  1990, 107â18; Michael 1997, 141; Weinberg 1997, 336; Otsuka 1998, 71).3 Nozickâs  argument, as stated previously, nowhere explicitly appeals to any claim about  property rights, and it is by no means obvious that an argument objecting to some  practice on the grounds that it amounts to forced labor needs even implicitly to do so. 
Procedural|Procedural|Procedural|TRUE|TRUE|TRUE|TRUE|TRUE|TRUE|469|"Normatively, optimal taxation theory addresses the question of ""how  best to raise revenues in a distorted economy."" "
Deontological|Deontological|Deontological|TRUE|TRUE|TRUE|TRUE|TRUE|TRUE|309|"Not A ""Fair"" Tax   means, we will allocate a greater proportion of the tax burden to  those of greater means. "
Utilitarian|Utilitarian|Utilitarian|TRUE|TRUE|TRUE|TRUE|TRUE|TRUE|266|Nozick  claims, a redistributive system invades that right making others âa part  owner of you giving them a property right in youâ. 
Libertarian|Libertarian|Deontological|TRUE|FALSE|FALSE|TRUE|FALSE|TRUE|45|Nozick has compared this to slavery. 
Rawlsian|Rawlsian|0|TRUE|FALSE|FALSE|TRUE|FALSE|TRUE|239|Nozick likens the imposition of redistributive taxes (typically progressively designed) on people who are working to earn money to partial enslavement.
Utilitarian|Utilitarian|Utilitarian|TRUE|TRUE|TRUE|TRUE|TRUE|TRUE|633|Nozick's basic assumption is that this society naturally develops into a state very limited in powers and responsibilities, an undertone that precludes most forms of taxation, particularly those tax structures that are redistributive in nature.
Rawlsian|Rawlsian|Utilitarian|TRUE|FALSE|FALSE|TRUE|FALSE|TRUE|424|Obviously, progressive taxation by mitigating inequalities in the  distribution of wealth could, if coupled with a wise program of public expenditures,  decrease the inequalities of opportunity. 
Procedural|Procedural|Procedural|TRUE|TRUE|TRUE|TRUE|TRUE|TRUE|504|Of course, there is a limit to liberalism's respect for individual  autonomy, and traditionally, it is drawn at the point where one person's  exercise of her autonomy infringes the autonomy of others. 
Libertarian|Libertarian|Libertarian|TRUE|TRUE|TRUE|TRUE|TRUE|TRUE|379|Of the characteristics of the tax system, probably equity or fairness was the  oldest requirement ever raised. 
Deontological|Deontological|Deontological|TRUE|TRUE|TRUE|TRUE|TRUE|TRUE|451|Of the main moral theories, libertarianism-with its particular  workmanship model of property rights-is the most hostile to raising  revenue for government expenditures through taxes.13' Nonetheless, even  libertarians generally approve of using taxes to maintain institutions that  enforce and protect individuals' property and contractual rights.1 32 Public  goods, such as national defense, necessarily benefit everyone, and free  riders cannot be practically excluded.1 33 Yet, whether a good is public or   125. 
Rawlsian|Rawlsian|0|TRUE|FALSE|FALSE|TRUE|FALSE|TRUE|570|On the first point, more private assets means there will be  more capital, which will have a positive impact on wages, which benefits  the working people, especially the young. 
Procedural|Procedural|Procedural|TRUE|TRUE|TRUE|TRUE|TRUE|TRUE|72|One of the central propositions of this chapter is that just as regulators look  for substantive compliance in the actions of those they regulate, citizens look for  substantive integrity in the authorities that seek to direct their actions. 
Procedural|Procedural|OTHER|TRUE|FALSE|FALSE|TRUE|FALSE|TRUE|342|One of the prime purposes of a tax system is to enable  government to distribute resources in such a way that no member of the society  is left alone to face unremitting hardship. 
Libertarian|Libertarian|Rawlsian|TRUE|FALSE|FALSE|TRUE|FALSE|TRUE|278|One option is to listen to the community and understand the grounds of  resistance so that changes can be made to policy and practice. 
Procedural|Procedural|Procedural|TRUE|TRUE|TRUE|TRUE|TRUE|TRUE|82|One way to achieve an efficient tax system (meaning a true consumption  tax) is to let people accumulate wealth in untaxed assets and then apply  the tax when the assets are cashed in to finance consumption. 
Deontological|Rawlsian|Rawlsian|FALSE|FALSE|TRUE|TRUE|FALSE|FALSE|564|One way to try to do so would be to argue that the state, in imposing taxation, engaged in theft, and that in order to prevent the theft one could lie to the state, just as one could lie to a thief.
Utilitarian|0|0|FALSE|FALSE|TRUE|TRUE|FALSE|FALSE|292|Only a tax system that burdens exclusively the poorest group would be foreclosed on account of the difference principle, because that scheme of public finance would necessarily entail some redistribution, in the form of public goods at least, from the worst-off to the better-off. 
Deontological|Deontological|Deontological|TRUE|TRUE|TRUE|TRUE|TRUE|TRUE|255|Opponents of progressivity argue that it is unfair  to penalize those who are successful in a free market economy,  and implicitly reject the idea that the government should help the  unsuccessful through the tax system.' 
Rawlsian|Rawlsian|Rawlsian|TRUE|TRUE|TRUE|TRUE|TRUE|TRUE|127|Or, if they consume the same amount of  the same goods, they should pay the same consumption taxes. 
Libertarian|Libertarian|Utilitarian|TRUE|FALSE|FALSE|TRUE|FALSE|TRUE|316|Our economy stifled by restrictive tax rates will  never produce enough revenue to balance the budget. 
Utilitarian|0|0|FALSE|FALSE|TRUE|TRUE|FALSE|FALSE|627|Our federal tax code contributes to damaging inequality in our nation and must be reshaped to ensure all pay their fair share. We are called to invest in a society that will meet the needs of all, especially those at the economic margins; this is a core tenet of our faith teaching. tax reform should make the tax code more progressive, raise revenue to support vital programs, and decrease inequality. tax justice will be a step toward mending the gap in income and wealth and toward a society and an economy of inclusion. 
Utilitarian|Utilitarian|0|TRUE|FALSE|FALSE|TRUE|FALSE|TRUE|604|Outlining the principles for and methods of tax collection for the  public and committing the organisation to the effective monitoring of compliance    Taxing Democracy   are further steps that a tax authority can take in an effort to win public support and  establish a cooperative and responsive relationship with the community at large. 
Rawlsian|Rawlsian|Rawlsian|TRUE|TRUE|TRUE|TRUE|TRUE|TRUE|572|Over the very long run, to the extent that a corporate tax  cut induces capital accumulation, which in turn raises the productivity of workers,  a competitive labor market will generate real wage increases. 
Utilitarian|Utilitarian|Utilitarian|TRUE|TRUE|TRUE|TRUE|TRUE|TRUE|617|Ownership is really about controlling state power and having  that state power set up in a way to exploit the general population and the  social resources and enforce property rights. 
Libertarian|Libertarian|Libertarian|TRUE|TRUE|TRUE|TRUE|TRUE|TRUE|312|Pacifist versions of libertarianism (which are possible but almost never endorsed) reject all enforceable duties and hence reject the possibility of a just state and a fortiori of just taxation.
Utilitarian|Utilitarian|Utilitarian|TRUE|TRUE|TRUE|TRUE|TRUE|TRUE|560|Part of this emphasis reflects the concerns of economists  and policy mavens that tax reform could improve the efficiency of  the economy and generate extra income for U.S. citizens. 
Procedural|Procedural|0|TRUE|FALSE|FALSE|TRUE|FALSE|TRUE|514|Paying taxes gives citizens a very real sense of participation in Government. 
Utilitarian|Utilitarian|Utilitarian|TRUE|TRUE|TRUE|TRUE|TRUE|TRUE|594|People desired that the system be fair, and the inequities removed. 
Deontological|Deontological|Deontological|TRUE|TRUE|TRUE|TRUE|TRUE|TRUE|15|People with different incomes shall pay different amount of taxes based on the principle that their sacrifice in form of taxes shall have the same “price” for themselves.
Utilitarian|Utilitarian|Utilitarian|TRUE|TRUE|TRUE|TRUE|TRUE|TRUE|455|People with higher income pay more but their loss is less than the overall gained happiness, so utilitarian government would impose progressive taxes.
Utilitarian|Utilitarian|Utilitarian|TRUE|TRUE|TRUE|TRUE|TRUE|TRUE|163|Perhaps more importantly, the tax authority, and the government  of which it is part, must communicate belief in citizens, responsiveness to their  concerns, and commitment to accord to each member of the democracy equal status  as a citizen, in spite of marked differences in their taxpaying circumstances. 
Libertarian|OTHER|0|FALSE|FALSE|FALSE|FALSE|FALSE|FALSE|320|Perhaps the most widely accepted principle of equity in taxation is that people in equal positions should be treated equally
Procedural|Procedural|Procedural|TRUE|TRUE|TRUE|TRUE|TRUE|TRUE|495|person has a right to get back what they have put in: if a person puts in more, they are  entitled to receive more. 
Utilitarian|Utilitarian|Rawlsian|TRUE|FALSE|FALSE|TRUE|FALSE|TRUE|489|Political institutions, such as the  tax system, must be part of that design. 
Utilitarian|Utilitarian|Utilitarian|TRUE|TRUE|TRUE|TRUE|TRUE|TRUE|581|Political parties, in this  approach, can be seen as playing groups of voters off against each other in attempting to  raise revenue at minimal political cost in terms of votes lost. 
Deontological|Rawlsian|Rawlsian|FALSE|FALSE|TRUE|TRUE|FALSE|FALSE|474|Poll taxes were employed  to impose equal charges upon the taxpayers, apparently reflecting the idea  of equal benefits from personal protection and equal costs. 
Procedural|Procedural|Procedural|TRUE|TRUE|TRUE|TRUE|TRUE|TRUE|195|Presently, some business properties are 'paying much more than their proper share and others are paying much less. The problem can best be solved, first, by making uniformity the objective and, second, by developing the skills to do it adequately.
Libertarian|Libertarian|0|TRUE|FALSE|FALSE|TRUE|FALSE|TRUE|639|President Bush has said that any tax reform must be revenue-neutral,  maintain a progressive tax system, and promote economic growth. 
Utilitarian|0|0|FALSE|FALSE|TRUE|TRUE|FALSE|FALSE|228|Pre-tax income assumes central moral significance, and taxation can resemble slavery.
Rawlsian|Rawlsian|Rawlsian|TRUE|TRUE|TRUE|TRUE|TRUE|TRUE|125|"Prior to this time some polls had indicated a majority agreed with the proposition  that ""rich people should pay more as a share of their income than low and middle income  people."" "
Procedural|Procedural|Procedural|TRUE|TRUE|TRUE|TRUE|TRUE|TRUE|412|Progressive  taxation develops when low and average incomes reach the political power to  shift on higher incomes the tax burden previously put on them. 
Deontological|Utilitarian|Rawlsian|FALSE|FALSE|FALSE|FALSE|FALSE|FALSE|476|Proponents of this approach often base their claim on drastic inequalities in the global distribution of resources and life chances, and on the role that international taxation could—and arguably should—play in remedying this situation by enabling a redistribution of resources towards less affluent parts of the world.
Utilitarian|Utilitarian|Utilitarian|TRUE|TRUE|TRUE|TRUE|TRUE|TRUE|562|Put another way, the hope for a progressive spending tax is that  the wealthy save more in part so that the not-wealthy can spend more. 
Deontological|Deontological|Deontological|TRUE|TRUE|TRUE|TRUE|TRUE|TRUE|237|Put more succinctly, for libertarians, taxation is theft.
Rawlsian|Rawlsian|0|TRUE|FALSE|FALSE|TRUE|FALSE|TRUE|426|Raise representation within the democratic process because it has been found that only when an electorate and a government are bound by the common interest of tax does democratic accountability really work; and finally to facilitate:
Rawlsian|0|0|FALSE|FALSE|TRUE|TRUE|FALSE|FALSE|116|Raising tax rates rewards and promotes tax shelter-  ing and evasion, and penalizes the return to productive activity. 
Rawlsian|Rawlsian|Utilitarian|TRUE|FALSE|FALSE|TRUE|FALSE|TRUE|648|Rationality is the consideration and acceptance of long-term aspects which  point beyond momentary interests (redistribution attenuating poverty helps maintain  public safety, so extra funds for increasing safety are not necessary). 
Libertarian|Libertarian|Libertarian|TRUE|TRUE|TRUE|TRUE|TRUE|TRUE|402|Rawls' difference  principle would give absolute priority to the worst off group. 
Libertarian|Libertarian|Rawlsian|TRUE|FALSE|FALSE|TRUE|FALSE|TRUE|352|Redistribution through higher taxes on the wealthy seems to be an obvious policy instrument to reduce the widening gap between the rich and the poor.
Deontological|Deontological|Deontological|TRUE|TRUE|TRUE|TRUE|TRUE|TRUE|16|Regardless of how the matter is stated, the entitlement version of libertarianism posits that coercive taxation is anathema (or, at least, should be kept to the bare minimum), and whatever level of taxation is allowed on no account should be used for redistribution, especially of the top-to-bottom kind
Rawlsian|Rawlsian|Rawlsian|TRUE|TRUE|TRUE|TRUE|TRUE|TRUE|329|Regressive taxes are not welcomed by utilitarian governments as the economic loss for people with lower income surpasses the overall happiness. 
Libertarian|Libertarian|Rawlsian|TRUE|FALSE|FALSE|TRUE|FALSE|TRUE|269|Respecting the standards in the legislative process that follow from the principle of tax justice is very obvious when it comes to substantiation.
Deontological|Deontological|Deontological|TRUE|TRUE|TRUE|TRUE|TRUE|TRUE|3|"Robert Nozick argues that taxation makes the  state a ""part owner"" of individuals, giving it a ""property right"" in people. "
Procedural|Procedural|Procedural|TRUE|TRUE|TRUE|TRUE|TRUE|TRUE|196|"Satisfaction of the  benefit principle (that the tax burden correspond to the level of benefits  received) will automatically require that those with equal benefits be treated  the same, assuming that this does not conflict with the governmental scheme  of ""overall distributive justice."" "
Rawlsian|Rawlsian|Rawlsian|TRUE|TRUE|TRUE|TRUE|TRUE|TRUE|365|Second, a goal of a progressive income tax is to reduce certain  inequalities of income produced by the marketplace. 
Libertarian|0|0|FALSE|FALSE|TRUE|TRUE|FALSE|FALSE|202|Second, and more broadly, the notion that equals should be treated  equally requires specification of the criteria used to determine who is equal. 
Libertarian|Libertarian|Libertarian|TRUE|TRUE|TRUE|TRUE|TRUE|TRUE|349|Second, lower tax rates, the  Treasury suggests, will lower barriers to entering the workforce. 
Procedural|0|Procedural|FALSE|TRUE|FALSE|TRUE|FALSE|TRUE|430|"Second, she argues that this ""justice deficiency"" gives rise to a duty of justice to pursue multilateral cooperation in a way that secures domestic distributive justice abroad. "
Procedural|Procedural|0|TRUE|FALSE|FALSE|TRUE|FALSE|TRUE|101|Second, the system must minimize, to the greatest possible extent, the tax  burden on those least able to bear it. 
Rawlsian|Rawlsian|Utilitarian|TRUE|FALSE|FALSE|TRUE|FALSE|TRUE|222|"See generally STAFF OF THE JOINT COMMITrEE ON TAXATION, 97TH CONG., 2D SESS.,   Not A ""Fair"" Tax   choice of a system of taxation reflects subjective political orientation  more than objective economic truth. "
Utilitarian|Utilitarian|Utilitarian|TRUE|TRUE|TRUE|TRUE|TRUE|TRUE|175|"See THOMAS PIKETTY, THE ECONOMICS OF INEQUALITY 100 (Arthur Goldhammer trans.,  2015) (""The primary tool for pure redistribution is fiscal redistribution, which makes it possible to  correct inequality due to unequal initial endowments and market forces while preserving as much as  possible ofthe allocative role ofthe price system.""). "
Procedural|Procedural|0|TRUE|FALSE|FALSE|TRUE|FALSE|TRUE|300|Sen argues that redistribution is necessary to ensure that a person  has the resources required to maximise their capability. 
Libertarian|Libertarian|Libertarian|TRUE|TRUE|TRUE|TRUE|TRUE|TRUE|53|Shaviro argues that a tax on earnings is precisely the wrong  solution in a world with unequal wage rates because a person with a  higher wage rate but lower earnings is better off than someone with a  lower wage rate and higher earnings on account of the welfare-maximizing  choices they are presumed to make.58 An income tax increases  that inequality by taxing the worse-off person more than the person  with greater welfare and less cash.59 Thus, an income tax is unjust on  these terms. 
Deontological|Deontological|Deontological|TRUE|TRUE|TRUE|TRUE|TRUE|TRUE|459|Similarly, a  system that imposes tax burdens based on the taxpayers' abilities to pay will  impose the same burden on taxpayers that have the same ability to pay (i.e. 
Libertarian|Libertarian|Libertarian|TRUE|TRUE|TRUE|TRUE|TRUE|TRUE|565|Similarly, efforts to support improvements to tax  administration have become more nuanced. 
Rawlsian|Rawlsian|Rawlsian|TRUE|TRUE|TRUE|TRUE|TRUE|TRUE|106|Similarly, self-ownership seems to deny that it can be permissible  to use people in order to help others, even when those others are in extreme need and the use  is very insignificant (e.g., to gently push an innocent bystander in order to save 10 innocent  lives). 
Deontological|Deontological|Deontological|TRUE|TRUE|TRUE|TRUE|TRUE|TRUE|285|Simplified tax forms and tax laws also preserve the  system's integrity. 
Deontological|Deontological|Deontological|TRUE|TRUE|TRUE|TRUE|TRUE|TRUE|10|Since those earning represent peopleâs labor, and people initially have the  right not to be forced to work for certain ends, Nozick argued, redistributive taxation is  morally on a par with forced labor. 
Libertarian|Libertarian|Libertarian|TRUE|TRUE|TRUE|TRUE|TRUE|TRUE|66|So much reliance by a government on VAT for ist revenue can end up deepening inequality in a country
Deontological|Deontological|Libertarian|TRUE|FALSE|FALSE|TRUE|FALSE|TRUE|596|So too are those who believe that their tax office fails  to carry out its duties with integrity, that is, in accordance with the principles of the  Taxpayerâs Charter in which taxpayers are promised treatment that is respectful,  helpful, impartial, and fair (Australian Taxation Offi ce 1997). 
Libertarian|Libertarian|Libertarian|TRUE|TRUE|TRUE|TRUE|TRUE|TRUE|348|social and economic inequalities are to be arranged so that they are to the greatest benefit of the least advantaged. If we adopt this principle then it is quite clear that redistribution including the one which takes form of progressive taxation is justified. 
Rawlsian|Rawlsian|0|TRUE|FALSE|FALSE|TRUE|FALSE|TRUE|413|Social institutions should be designed to equalize  the potential welfare of every individual. 
Deontological|Deontological|Deontological|TRUE|TRUE|TRUE|TRUE|TRUE|TRUE|557|Society will benefit from the greater tax revenue. 
Utilitarian|Rawlsian|Utilitarian|FALSE|TRUE|FALSE|TRUE|FALSE|TRUE|245|Some strands of libertarian thought suggest that the charitable tax subsidies are in and of themselves illegitimate. These strands of libertarianism forbid not only redistribution but also anything except the most minimal provision of public goods needed to protect life and property, such as defense. Yet several other strands do see a role for the state to produce varying amounts of public goods and engage in some redistribution, ranging from providing a safety net to the very poorest to assisting victims of past injustices.
Utilitarian|Utilitarian|Utilitarian|TRUE|TRUE|TRUE|TRUE|TRUE|TRUE|561|Still, most of us probably think that it is important that laws that differentiate between us at least be justified with some significant moral or policy argument.
Rawlsian|Rawlsian|Utilitarian|TRUE|FALSE|FALSE|TRUE|FALSE|TRUE|221|Studies have shown that taxation needs to be applied uniformly to all for an  efficiency state. 
Procedural|Procedural|Procedural|TRUE|TRUE|TRUE|TRUE|TRUE|TRUE|90|Such  skepticism follows readily from the principle of self-ownership, which requires that all agents  respect the moral rights of individuals, such as their rights over their persons and their  legitimate possessions. 
Rawlsian|Procedural|0|FALSE|FALSE|FALSE|FALSE|FALSE|FALSE|444|Such tax, contributes to the pool of a countries resources. 
Deontological|Deontological|0|TRUE|FALSE|FALSE|TRUE|FALSE|TRUE|318|Sweden, in  contrast, is as unequal as the United States in market income, but carries out the  largest redistribution to remove more than half of the initial inequality. 
Deontological|Rawlsian|Deontological|FALSE|TRUE|FALSE|TRUE|FALSE|TRUE|241|Taking away a part of the fruit of one’s work through progressive taxes actually means that, during the time the person was working to earn that part, he or she was performing enforced work without a proper reward – a kind of slavery.
Deontological|Deontological|Deontological|TRUE|TRUE|TRUE|TRUE|TRUE|TRUE|182|"Taking this view, taxation could be levied, not only because of its functions as a revenue-raising mechanism-necessary to secure the existing distribution of holdings-but also considering its potential to correct this distribution. That is, taxation may appropriate from individuals the share of market returns that is not rightfully theirs and redirect (i.e., redistribute) it toward a
more entitled destination."
Utilitarian|0|0|FALSE|FALSE|TRUE|TRUE|FALSE|FALSE|502|"TAs a first step, suppose that the basic structure of society distributes certain  primary goods, that is, things that every rational man is presumed to want. | Input_bootstrapping/Distributive Justice - Some Institutional Implication of Rawls' A Theory of Justice.txt | ['Deontological'] | roberta-large AND paraphrase-multilingual-mpnet-base-v2
The just savings principle deals with the distribution of wealth among generations. "
Utilitarian|Utilitarian|Utilitarian|TRUE|TRUE|TRUE|TRUE|TRUE|TRUE|168|Tautologically, any conceivable tax arrangement will treat identically situated taxpayers equally.
Libertarian|Libertarian|0|TRUE|FALSE|FALSE|TRUE|FALSE|TRUE|58|Tax authorities are brokers for social order and harmony in democracies. 
Deontological|0|0|FALSE|FALSE|TRUE|TRUE|FALSE|FALSE|584|Tax Reform for Fairness, Simplicity, and Economic Growth. 
Deontological|Rawlsian|0|FALSE|FALSE|FALSE|FALSE|FALSE|FALSE|34|Tax structures, rates and exemptions are all determined jointly in political equilibrium  and so will reflect the relative voting power of groups in society. 
Utilitarian|Rawlsian|OTHER|FALSE|FALSE|FALSE|FALSE|FALSE|FALSE|297|Taxation according to potential to earn is alluring to those concerned  with distributional fairness because it imposes more tax on  people with greater abilities than those with lesser abilities. 
Libertarian|Libertarian|Libertarian|TRUE|TRUE|TRUE|TRUE|TRUE|TRUE|68|Taxation and Forced Labor   Nozickâs first argument (1974, 169â71) can be summarized as follows: when you are  forced to pay in taxes a percentage of what you earn from laboring, you are in effect  forced to labor for someone else because the fruit of part of your labor is taken from  you against your will and used for someone elseâs purposes. 
Deontological|Deontological|Deontological|TRUE|TRUE|TRUE|TRUE|TRUE|TRUE|33|Taxation and in particular the perception  that tax systems are unfair has been at the heart of these  debates. 
Procedural|Procedural|0|TRUE|FALSE|FALSE|TRUE|FALSE|TRUE|456|Taxation and income transfers to the poorest segment of society are the most direct way to keep inequality in check and reduce poverty in the short term.
Libertarian|Libertarian|Libertarian|TRUE|TRUE|TRUE|TRUE|TRUE|TRUE|403|Taxation and Self-Ownership   Nozickâs second argument (1974, 171â72) is essentially that each individual owns  himselfâhis body and its partsâand his labor. 
Libertarian|Libertarian|0|TRUE|FALSE|FALSE|TRUE|FALSE|TRUE|356|Taxation became an instrument of the state to  support economic development. 
Utilitarian|Utilitarian|0|TRUE|FALSE|FALSE|TRUE|FALSE|TRUE|619|Taxation can very easily be used to make the distribution of incomes and wealth more equal, either by transferring cash from the rich to the poor, or by providing the same state services to everyone while taxing the rich more than the poor in order to pay for them.
Libertarian|Libertarian|0|TRUE|FALSE|FALSE|TRUE|FALSE|TRUE|488|Taxation in general, is an  important conduit to generate revenue and also a tool to redistribute wealth. 
Deontological|Deontological|0|TRUE|FALSE|FALSE|TRUE|FALSE|TRUE|179|Taxation is a feature of government and, as such, also aims first  and foremost at justice and the good life. 
Deontological|Deontological|Deontological|TRUE|TRUE|TRUE|TRUE|TRUE|TRUE|6|Taxation is not theft, because citizens have agreed to pay taxes. This is part of the “social contract,” which is a kind of agreement between citizens and the government, whereby the citizens agree to pay taxes and obey the laws, in return for the government’s protection.
Rawlsian|Rawlsian|Rawlsian|TRUE|TRUE|TRUE|TRUE|TRUE|TRUE|131|"Taxation is to be used as a tool of social policy: ""The redistribution of  national income in favor of the lower classes is a conscious aim of modern social policy."" "
Procedural|Procedural|0|TRUE|FALSE|FALSE|TRUE|FALSE|TRUE|383|Taxation on property and wealth will strengthen the economies of a country. 
Utilitarian|Utilitarian|Utilitarian|TRUE|TRUE|TRUE|TRUE|TRUE|TRUE|154|Taxation on wealth therefore would be demoralizing as many people  think of paying taxes as a punishment than a duty to nation building. 
