Annotator_0_Cat|Annotator_1_Cat|Annotator_2_Cat|0_1_Cat_Agr|0_2_Cat_Agr|1_2_Cat_Agr|2/3-Agreem|3/3-Agreem|Int_Ext_Agr|id|sentence/context - better?
Deontological|Deontological|Deontological|TRUE|TRUE|TRUE|TRUE|TRUE|TRUE|4|Taxation should apply to all who have property. 
Utilitarian|Utilitarian|0|TRUE|FALSE|FALSE|TRUE|FALSE|TRUE|528|Taxation should be done through  just means and should be for all. 
Procedural|Procedural|Procedural|TRUE|TRUE|TRUE|TRUE|TRUE|TRUE|425|Taxation should not be done on wealth, as it would discourage the ethics of  hard work. 
Rawlsian|0|0|FALSE|FALSE|TRUE|TRUE|FALSE|FALSE|375|Taxation should, therefore, be implemented evenly on all tools to  foster equality and encourage hard work and commitment to achieving oneâs economic vision  and purpose. 
Rawlsian|Rawlsian|Utilitarian|TRUE|FALSE|FALSE|TRUE|FALSE|TRUE|188|Taxes are, thus, the differentiated  prices persons pay for public goods. 
Rawlsian|0|Rawlsian|FALSE|TRUE|FALSE|TRUE|FALSE|TRUE|176|Taxpayer concerns should be  taken seriously and engaged with openly, inclusively and thoughtfully against the  backdrop of basic system goals and principles. 
Utilitarian|Utilitarian|Utilitarian|TRUE|TRUE|TRUE|TRUE|TRUE|TRUE|580|That a lump-sum tax maximizes utility in a perfectly competitive market rests on the  assumption that a perfectly competitive market is maximally efficient. 
Procedural|Procedural|0|TRUE|FALSE|FALSE|TRUE|FALSE|TRUE|273|That is to say, what is at stake in the challenge of  tax compliance is not just tax revenues, it is democracy itself (Brooks, 1998, p. 33). 
Procedural|0|0|FALSE|FALSE|TRUE|TRUE|FALSE|FALSE|418|That is, only  income in excess of what was needed for existence should be subject to tax. 
Rawlsian|Rawlsian|Rawlsian|TRUE|TRUE|TRUE|TRUE|TRUE|TRUE|443|That is, the gold standard for a horizontally equitable tax, in this view, is that two taxpayers with similar objective measures of financial capability to satisfy the government's demand for revenue should pay a similar amount of tax.
Rawlsian|Rawlsian|Rawlsian|TRUE|TRUE|TRUE|TRUE|TRUE|TRUE|128|That is, while most libertarians see self-ownership as a morally  important idea, few treat it as the starting point of their theories.5  Instead, they seek to  develop theories that (a) honor people as rights-holders, sovereign individuals, whom we need  to treat as the primary claimants of their lives and bodies, while (b) avoiding many of the more  implausible elements of the maximally protection version of self-ownership. 
Rawlsian|Rawlsian|Rawlsian|TRUE|TRUE|TRUE|TRUE|TRUE|TRUE|335|That the taxpayer  benefits from some of what the state does with his taxes is irrelevant to whether  taxation is forced labor, however, for insofar as his tax money is used for functions that  benefit not him but others, then he has been forced to labor for those others. 
Utilitarian|Utilitarian|Utilitarian|TRUE|TRUE|TRUE|TRUE|TRUE|TRUE|165|The  basic structure can be arranged so that these contingencies  work for the good of the least fortunate . 
Rawlsian|Rawlsian|Rawlsian|TRUE|TRUE|TRUE|TRUE|TRUE|TRUE|138|The  part of your labor that generates the money paid as taxes is labor you would not have  performed voluntarily. 
Deontological|Libertarian|Deontological|FALSE|TRUE|FALSE|TRUE|FALSE|TRUE|389|The Addis Ababa commitments have the potential to  make a real and lasting contribution to strengthening  tax systems in developing countries. 
Deontological|Utilitarian|Utilitarian|FALSE|FALSE|TRUE|TRUE|FALSE|FALSE|467|The answer to this question is important because it suggests policy  proposals that will improve European standards of living. 
Procedural|Procedural|Procedural|TRUE|TRUE|TRUE|TRUE|TRUE|TRUE|225|the anti-progressive tax argument is often characterized as an argument that every person has a responsibility to take care of himself, and no one, including the wealthy, has an obligation to assist those in need.
Deontological|Deontological|Deontological|TRUE|TRUE|TRUE|TRUE|TRUE|TRUE|5|The argument developed is that  integrity and compliance are most likely to be optimised when a tax authority  pursues a citizen-inclusive approach to compliance through policies that encourage  dialogue and persuasion, combined with an effective mix of incentives and  sanctions. 
Procedural|Procedural|0|TRUE|FALSE|FALSE|TRUE|FALSE|TRUE|252|The author recognizes throughout his article the compelling force of the principle that a  person is entitled to what he has earned. 
Rawlsian|Rawlsian|Rawlsian|TRUE|TRUE|TRUE|TRUE|TRUE|TRUE|120|The authors argue that any tax based on  income, accompanied by excessive marginal rates will deter labor. 
Rawlsian|Rawlsian|0|TRUE|FALSE|FALSE|TRUE|FALSE|TRUE|644|The case has stronger appeal when progressive taxation is viewed as a means of reducing  economic inequalities. 
Deontological|Deontological|Deontological|TRUE|TRUE|TRUE|TRUE|TRUE|TRUE|539|The characteristics which enter the welfare weights determine the dimensions  along which society considers redistribution to be fair. 
Procedural|Procedural|Procedural|TRUE|TRUE|TRUE|TRUE|TRUE|TRUE|94|The cobbler argues that the tax, which will be used to achieve a more  egalitarian distribution, will violate his self-ownership.
Rawlsian|Rawlsian|Rawlsian|TRUE|TRUE|TRUE|TRUE|TRUE|TRUE|135|The consideration of both arguments in a taxation system may also improve the justification of the inheritance taxation within a society. 
Procedural|Utilitarian|Utilitarian|FALSE|FALSE|TRUE|TRUE|FALSE|FALSE|447|The diminishing capacity of sovereign states to collect tax revenues has led  many to view global cooperation amongst states as a way of restoring state  sovereignty and, hopefully, promoting justice. 
Rawlsian|Rawlsian|Rawlsian|TRUE|TRUE|TRUE|TRUE|TRUE|TRUE|551|The equal sacrifice principle posits that fair taxation will require equal sacrifice from all, leaving the distribution of welfare generated by the market unchanged.
Rawlsian|Rawlsian|Rawlsian|TRUE|TRUE|TRUE|TRUE|TRUE|TRUE|548|The equity in distributing the cumulative tax burden serves as the supporting argument  for the majority of those supporting progressive taxation. 
Procedural|Procedural|Procedural|TRUE|TRUE|TRUE|TRUE|TRUE|TRUE|75|The exercise of state power to  control a slave or a factory worker occurs, as it were, automatically by design  and neither the slave owner nor the capitalist has to actually spend a dime for  the privilege. 
Deontological|Deontological|Deontological|TRUE|TRUE|TRUE|TRUE|TRUE|TRUE|26|The fact  that taxation does infringe upon one's liberty to dispose of one's economic resources has led some writers in the conservative tradition to view taxation as a kind of forced labor.
Utilitarian|Utilitarian|0|TRUE|FALSE|FALSE|TRUE|FALSE|TRUE|625|The Fair Tax  will give the states a broader, fairer and more solid income tax base  from which to raise their revenue. 
Libertarian|0|Utilitarian|FALSE|FALSE|FALSE|FALSE|FALSE|FALSE|388|The fear of social stigmatization as a possible deterrent factor is a confirmation of the belief that tax compliance takes place within a  social context (OECD, 2010; Kirchler, 2007), and the existence of the social norms effect on compliance behavior. 
Rawlsian|Rawlsian|0|TRUE|FALSE|FALSE|TRUE|FALSE|TRUE|360|The field of welfare economics is largely based on utilitarian philosophy, as it is concerned  with ensuring that resources are allocated among a community to maximise the welfare of  that community. 
Deontological|0|Deontological|FALSE|TRUE|FALSE|TRUE|FALSE|TRUE|325|The first policy option recognizes that taxation lessens the amount of money, and thereby utility, enjoyed by individuals and demands the least sacrifice, in collective utility loss, while maintaining social welfare at a maximum level.
Libertarian|Libertarian|Libertarian|TRUE|TRUE|TRUE|TRUE|TRUE|TRUE|54|The first principle is that any tax must have a firm basis in law. Much of the history of Western political movements has been based on opposition to arbitrary taxation.
Deontological|Deontological|Deontological|TRUE|TRUE|TRUE|TRUE|TRUE|TRUE|11|The first represents absolute loss at the hands of  the tax system, that is, the individual cannot get ahead, no matter how hard he/she  works, because of taxation. 
Procedural|Procedural|Procedural|TRUE|TRUE|TRUE|TRUE|TRUE|TRUE|74|The focus has been  on compliance, that is, the extent to which taxpayers do what is expected of them  and are prepared to cooperate with the authority. 
Rawlsian|Rawlsian|Rawlsian|TRUE|TRUE|TRUE|TRUE|TRUE|TRUE|621|The general principle -one that needs no defense is  that similarly situated people should be treated similarly, that equals should be treated equally. 
Procedural|Procedural|Procedural|TRUE|TRUE|TRUE|TRUE|TRUE|TRUE|88|"The goal of ""economic efficiency""  is that ""taxes should interfere as little as possible with the incentives to engage in spe-  cific types of economic activity except to the extent that Congress intends such effects."" "
Procedural|0|Procedural|FALSE|TRUE|FALSE|TRUE|FALSE|TRUE|105|The goal of equal treatment for those in equal economic positions  is an admirable one. 
Utilitarian|Utilitarian|Utilitarian|TRUE|TRUE|TRUE|TRUE|TRUE|TRUE|151|The government can’t be a thief, because it is the government that defines property rights through its laws. The government can simply make laws that say that the money you are supposed to pay in taxes isn’t really yours in the first place; it is the government’s money.
Libertarian|Libertarian|Libertarian|TRUE|TRUE|TRUE|TRUE|TRUE|TRUE|46|The high income earner can afford to give up  more than the low income earner. 
Utilitarian|Utilitarian|0|TRUE|FALSE|FALSE|TRUE|FALSE|TRUE|417|"The idea is that the proportional tax is ""neutral"" in that everyone  is equally worse off. "
Libertarian|Libertarian|Libertarian|TRUE|TRUE|TRUE|TRUE|TRUE|TRUE|51|The implication of this assumption is that  when there are low audit probabilities and low penalties, the tendency for evasion will be higher, while if there is a high tendency for  detection and penalties are severe, fewer people will evade taxes (Fjeldstad, Schulz-Herzenberg and Sjursen, 2012). 
Rawlsian|Rawlsian|Rawlsian|TRUE|TRUE|TRUE|TRUE|TRUE|TRUE|122|The importance of equity and fairness in taxation is that it does not really matter if the outcome favors the individual taxpayer or not. 
Deontological|Deontological|Deontological|TRUE|TRUE|TRUE|TRUE|TRUE|TRUE|303|The increased price is only a liberty cost if liberty is property, and any  interference with one's right to keep everything produced in the market  is a matter of justice. 
Procedural|0|0|FALSE|FALSE|TRUE|TRUE|FALSE|FALSE|314|The increasing inequality of market  income can be significantly ameliorated by the redistributive effect of the tax transfer  system, if it is appropriately targeted. 
Utilitarian|Rawlsian|Utilitarian|FALSE|TRUE|FALSE|TRUE|FALSE|TRUE|142|The inevitable culmination is maximum redistribution. 
Procedural|Procedural|0|TRUE|FALSE|FALSE|TRUE|FALSE|TRUE|253|The labour of his body and the work of his hands we may say are properly his. 
Rawlsian|Rawlsian|Rawlsian|TRUE|TRUE|TRUE|TRUE|TRUE|TRUE|247|The libertarian will quickly respond that we have missed the point. The claim is not that we are entitled to our income because we deserve our natural talents. Rather we are entitled to our in­come because we exercise our talents in a relationship of voluntary exchange with others. lt is the productive act and its product to which we are entitled.
Utilitarian|Utilitarian|Utilitarian|TRUE|TRUE|TRUE|TRUE|TRUE|TRUE|155|The merit of taxation as a response to dynastic inequality is its uniform application on a metric of income or wealth. The provision of universal, quality public goods to all in a society would also substantially improve the opportunity and mobility of low income and wealth individuals and households. 
Utilitarian|Utilitarian|0|TRUE|FALSE|FALSE|TRUE|FALSE|TRUE|591|The model is amenable to different definitions of distributional  fairness and can adjust to accommodate specific limitations in  tax design that may arise from political or administrative constraints. 
Utilitarian|Utilitarian|Utilitarian|TRUE|TRUE|TRUE|TRUE|TRUE|TRUE|289|The model thus suggests that the presence of government  expenditures may serve as a motivating factor for taxpayer compliance, especially when the taxpayers value the goods and services they  perceive to be receiving from the government (Alm, McClelland and Schulze, 1992; Alm, 1999; Fjeldstad, et al., 2012). 
Rawlsian|Rawlsian|Rawlsian|TRUE|TRUE|TRUE|TRUE|TRUE|TRUE|597|The modem benefit principle generally likens taxation  and public expenditures to exchanges in a marketplace: the more a taxpayer  gets from the government, the more the taxpayer should pay in taxes. 
Libertarian|Libertarian|Libertarian|TRUE|TRUE|TRUE|TRUE|TRUE|TRUE|384|The most effective solution to the equal opportunity challenge  would make the talents of all members of society a common good  shared by all-each person would be entitled to a pro rata share of the  total returns to ability in the community. 
Rawlsian|Rawlsian|Utilitarian|TRUE|FALSE|FALSE|TRUE|FALSE|TRUE|140|The need is for more redistribution to be carried out through the tax system. 
Procedural|Procedural|Procedural|TRUE|TRUE|TRUE|TRUE|TRUE|TRUE|81|The normative coupling of taxation and representation asserts a procedural condition for legitimacy. Justified extraction of revenues through taxation necessitates that those who are liable to taxes consent to their imposition and consent happens, in effect, through representatives.
Libertarian|Libertarian|Libertarian|TRUE|TRUE|TRUE|TRUE|TRUE|TRUE|41|"The notion that the state's ability to tax ""extinguishe[s]"" the individual's  liberty interest 22 depends not only on a conception of liberty  that is absolute, but also a liberty without corresponding obligations. "
Procedural|Procedural|Procedural|TRUE|TRUE|TRUE|TRUE|TRUE|TRUE|490|The objector may then say that even if it is the case that higher-tax bracket individuals receive fewer benefits than do lower-tax bracket individuals, the point is not necessarily to benefit the high-tax-bracket individual as an individual, but to benefit the society of which he is a part. 
Deontological|Deontological|Libertarian|TRUE|FALSE|FALSE|TRUE|FALSE|TRUE|233|"The only legitimate system of taxation under the Nozickean paradigm is generally understood to be that which is necessary to raise revenues for the maintenance of institutions needed
to protect the system of private property and free market exchanges, such as the monetary and justice systems."
Utilitarian|0|Utilitarian|FALSE|TRUE|FALSE|TRUE|FALSE|TRUE|409|The only way to use the NAP to ground the libertarian’s objection to taxation is to say that it’s wrong to take away the property that a taxpayer is morally entitled to keep.
Procedural|Procedural|0|TRUE|FALSE|FALSE|TRUE|FALSE|TRUE|496|"The outcome showed that utilitarianism would recommend taxes which balance the principles of equality, need, and dessert while treating everyone equally and taking as a basis increase of 
net utility for a long-term and not satisfying needs for short-term."
Rawlsian|Rawlsian|0|TRUE|FALSE|FALSE|TRUE|FALSE|TRUE|110|The Paretian principle, named after the political economist Vilfredo Pareto, stands for the  idea that society should adopt any change that improves at least one person's welfare while harming no  one's. 
Deontological|0|Utilitarian|FALSE|FALSE|FALSE|FALSE|FALSE|FALSE|634|The predicted outcomes of the climate crisis are just one of several dimensions of inequality when it comes to environmental policy. This report has shown that there could be a role for environmental taxation in addressing these inequalities, and that the vision and ob-jectives of the tax justice movement and the implementation of environmental taxation can indeed be compatible in theory and in practice.
Deontological|Rawlsian|Utilitarian|FALSE|FALSE|FALSE|FALSE|FALSE|FALSE|553|The principle of compensatory justice sets an upper limit on the taxes that may be demanded from an individual. According to Nozick's conception of individual rights, utilitarian considerations can never justify a violation of rights. Within the limits imposed by compensatory justice, efficiency will determine the exact outlines of the tax.
Utilitarian|Deontological|Utilitarian|FALSE|TRUE|FALSE|TRUE|FALSE|TRUE|525|The principle of uniformity of taxation ensures that identical or comparable situations are treated equally
Libertarian|Libertarian|0|TRUE|FALSE|FALSE|TRUE|FALSE|TRUE|353|The priorities are likely to involve tightening laws, building alliances with  professional bodies, educating the public, and amending tax returns. 
Libertarian|Libertarian|Libertarian|TRUE|TRUE|TRUE|TRUE|TRUE|TRUE|37|The proposal is that we implement a tax that is a utility tax in two ways: (1) it determines the distribution of the tax burden according to utility calculations, and (2) it makes it the case that people pay the tax in terms of utility.
Utilitarian|0|0|FALSE|FALSE|TRUE|TRUE|FALSE|FALSE|546|"The question has been thus phrased, ""[s]ince the rich and  poor pay at the same rate for bread, why shouldn't they pay at the same rate in buying government?"" "
Procedural|Procedural|Procedural|TRUE|TRUE|TRUE|TRUE|TRUE|TRUE|283|The question, however, remains:  How should trade-offs be made that maximize revenue gained from compliance  activities while protecting the integrity of the tax system? 
Utilitarian|Utilitarian|Utilitarian|TRUE|TRUE|TRUE|TRUE|TRUE|TRUE|578|The questions of equity (fairness), efficiency and simplicity are the core issues  presently discussed in terms of comprehensively restructuring the income tax. 
Rawlsian|Rawlsian|0|TRUE|FALSE|FALSE|TRUE|FALSE|TRUE|294|The rate of income tax must be calculated to produce the maximum revenues for transfer to the least advantaged, taking into account any disin­centive effect
Deontological|Libertarian|Utilitarian|FALSE|FALSE|FALSE|FALSE|FALSE|FALSE|641|The result  is proportionate taxation at the highest income levels. 
Libertarian|Libertarian|Libertarian|TRUE|TRUE|TRUE|TRUE|TRUE|TRUE|395|The role of government, and taxation,  was to support stabilisation, but also redistribution. 
Libertarian|Libertarian|Libertarian|TRUE|TRUE|TRUE|TRUE|TRUE|TRUE|313|The second principle requires that deviations from equality be allowed  only when they are necessary to maximize the well being of the least advantaged  class. 
Rawlsian|Rawlsian|Rawlsian|TRUE|TRUE|TRUE|TRUE|TRUE|TRUE|118|The second principle, which  demands that economic inequalities are justifiable only if they benefit  the least advantaged, can be satisfied through the combination of a   wide variety of institutions, of which the tax system is only one.
Deontological|Deontological|Deontological|TRUE|TRUE|TRUE|TRUE|TRUE|TRUE|291|The second principle, which demands that economic inequalities are justifiable only if they benefit the least advantaged, can be satisfied through the combination of a wide variety of institutions, of which the tax system is only one.
Procedural|Procedural|Libertarian|TRUE|FALSE|FALSE|TRUE|FALSE|TRUE|100|The second requirement of the difference principle, the requirement that inequalities be to the benefit of the least well-off, is the element that is often appealed to in order to justify progressive taxation and general theories of taxation that impose heavier taxation on economically betteroff members of society.
Procedural|Procedural|Procedural|TRUE|TRUE|TRUE|TRUE|TRUE|TRUE|427|The second, is the extent to which citizens believe that the tax office  has the power to take action against different kinds of taxpayers who decide to defy  it. 
Libertarian|Libertarian|0|TRUE|FALSE|FALSE|TRUE|FALSE|TRUE|213|The sheer  weight of public support for ensuring that large corporates pay their fair share  suggests that consideration should be given to more active, effective and perhaps  more public enforcement strategies with this segment of the taxpaying community. 
Utilitarian|Utilitarian|Utilitarian|TRUE|TRUE|TRUE|TRUE|TRUE|TRUE|166|The social planner’s goal is to choose the tax system that maximizes the representative consumer’s welfare, knowing that the consumer will respond to whatever incentives the tax system provides.
Rawlsian|Rawlsian|Rawlsian|TRUE|TRUE|TRUE|TRUE|TRUE|TRUE|203|The starting point for determining a person's  fair share must be the proposition that, as equals before the  state, each of us ought to be required to pay the same absolute  amount of tax to it. 
Utilitarian|Utilitarian|0|TRUE|FALSE|FALSE|TRUE|FALSE|TRUE|620|The support for a tax system hypothesis   The tax system is a core government instrumentality and as such should be regarded  favourably by both security oriented and harmony oriented citizens, albeit for  different reasons. 
Rawlsian|0|Rawlsian|FALSE|TRUE|FALSE|TRUE|FALSE|TRUE|532|"The tax fairness position associated with utilitarianism is ""sacrifice theory,"" which comes in various versions, all of which rely on the ""scientific"" notion of the declining marginal utility of money."
Libertarian|Libertarian|Libertarian|TRUE|TRUE|TRUE|TRUE|TRUE|TRUE|350|The tax is unambiguously a proportional tax on incomes earned. 
Rawlsian|Rawlsian|Rawlsian|TRUE|TRUE|TRUE|TRUE|TRUE|TRUE|226|The tax system that develops under this premise prescribes a redistributive (i.e., progressive) tax structure so that whatever the pre-tax distribution of resources may be, the after-tax allocation aims at maximum equality.
Libertarian|Libertarian|Libertarian|TRUE|TRUE|TRUE|TRUE|TRUE|TRUE|40|The tax transfer system is one of the tools available to governments to regulate such  inequities: progressive tax systems can apply higher taxes to those with a greater ability to   pay, while transfer systems can redistribute taxes to those in need. 
Deontological|Procedural|0|FALSE|FALSE|FALSE|FALSE|FALSE|FALSE|216|"The tax which each  individual is bound to pay ought to be certain, and not arbitrary. | Input_bootstrappingloop3/When Two Tax Theories Collide - A Look at the History and Future of Progressive and Proportionate Personal Income Taxation.txt | ['Procedural'] | roberta-large AND paraphrase-multilingual-mpnet-base-v2
Economic efficiency  serves as an indicator of responsible fiscal policy. | Input_bootstrappingloop3/When Two Tax Theories Collide - A Look at the History and Future of Progressive and Proportionate Personal Income Taxation.txt | ['Utilitarian'] | roberta-large AND paraphrase-multilingual-mpnet-base-v2
The Treasury states that, [a] tax that places significantly different  burdens on taxpayers in similar economic circumstances is not fair. "
Deontological|Deontological|Deontological|TRUE|TRUE|TRUE|TRUE|TRUE|TRUE|32|The taxes paid shall not result in a greater loss in their welfares. The fundamental principle is that after paying the taxes people with originally higher income will still have more welfare at the end than those who had a lesser amount of welfare.
Rawlsian|Rawlsian|Rawlsian|TRUE|TRUE|TRUE|TRUE|TRUE|TRUE|523|The traditional utilitarian argument mentioned above, is that since taxation is concerned with raising money, the method which should be adopted to achieve this goal is one which minimises the utility lost by the deprivation of the enjoyment of the assets confiscated to satisfy the tax.
Deontological|Deontological|0|TRUE|FALSE|FALSE|TRUE|FALSE|TRUE|327|The usual conclusion is that tax collection for the financing of such goods is necessary to force everyone to pay his fair share for a good from which everyone benefits.
Deontological|Deontological|Deontological|TRUE|TRUE|TRUE|TRUE|TRUE|TRUE|1|The usual starting point for  implementing equality-based norms is that people who are identical  in relevantrespects should be treated identically. 
Rawlsian|Rawlsian|Utilitarian|TRUE|FALSE|FALSE|TRUE|FALSE|TRUE|647|The utilitarian approach generates equal absolute sacrifice taxes that are progressive, flat or regressive at all levels of income.
Rawlsian|0|Rawlsian|FALSE|TRUE|FALSE|TRUE|FALSE|TRUE|217|The utilitarianian philosophy accepts tax policies only if the benefits of the paid taxes surpass benefits of alternative ways of spending the amount of money paid 
Libertarian|Libertarian|Libertarian|TRUE|TRUE|TRUE|TRUE|TRUE|TRUE|42|There is another plank that is necessary to define the way in which tax  officers and taxpayers should interact in pursuit of the ultimate goal of supporting  the Australian democracy, tax law. 
Libertarian|Libertarian|Libertarian|TRUE|TRUE|TRUE|TRUE|TRUE|TRUE|298|Therefore,  progressiveness in taxation becomes one of the main instruments of tax  policy. 
Procedural|0|0|FALSE|FALSE|TRUE|TRUE|FALSE|FALSE|510|Therefore,  taxing large incomes at higher rates than lower incomes is fair. 
Procedural|Procedural|Procedural|TRUE|TRUE|TRUE|TRUE|TRUE|TRUE|92|Therefore, a tax system with horizontal inequity can be an optimum only if it helps the group  discriminated against, i.e., no reform can improve the welfare of those discriminated against. 
Libertarian|Libertarian|Libertarian|TRUE|TRUE|TRUE|TRUE|TRUE|TRUE|62|"Therefore, all would have voted for the highest possible minimum (the ""maximin""). All would have agreed to inequality only if it improved the position of the bottom."
Procedural|Procedural|Procedural|TRUE|TRUE|TRUE|TRUE|TRUE|TRUE|486|Therefore, he  proceeds on the basis of certain presumptions, starting from two premises:  the consumption of general public services varies directly with individual  income; and all citizens are equal in front of the law in terms of taxation. 
Deontological|Libertarian|Deontological|FALSE|TRUE|FALSE|TRUE|FALSE|TRUE|436|These include the right to equal access to land  and natural resources and to land reform,6 access to adequate housing,7  access to health care, sufficient food and water, social security,8 and  education.9 These rights or expectations are difficult to accomplish in  any society no matter how good the intentions. 
