Annotator_0_Cat|Annotator_1_Cat|Annotator_2_Cat|0_1_Cat_Agr|0_2_Cat_Agr|1_2_Cat_Agr|2/3-Agreem|3/3-Agreem|Int_Ext_Agr|id|sentence/context - better?
Utilitarian|Utilitarian|Utilitarian|TRUE|TRUE|TRUE|TRUE|TRUE|TRUE|589|If taxpayers offer compliance, the tax office, as part of government,  should reciprocate with integrity. 
Utilitarian|Utilitarian|Utilitarian|TRUE|TRUE|TRUE|TRUE|TRUE|TRUE|552|If the government fails to meet the needs of its citizens in providing  basic public goods, such as law and order, education and basic social  security, it is quite understandable that the willingness to support the state will  suffer.6 In such a situation, it is probable that the citizens will rely on private  activities in providing these goods. 
Rawlsian|0|Rawlsian|FALSE|TRUE|FALSE|TRUE|FALSE|TRUE|124|If the taxpayers in the highest tax brackets did not pay taxes at higher rates, more of the burden would fall to those who would have more trouble bearing it, and this is not fair.
Deontological|Deontological|Deontological|TRUE|TRUE|TRUE|TRUE|TRUE|TRUE|27|If we realize what is at stake, and put the general interest first, we  can have a tax system that will allow us to grow and prosper. 
Libertarian|Libertarian|Libertarian|TRUE|TRUE|TRUE|TRUE|TRUE|TRUE|236|Import taxes  Taxing imported goods would encourage the development of the local sector and decrease exposure to global volatility. 
Utilitarian|Utilitarian|Utilitarian|TRUE|TRUE|TRUE|TRUE|TRUE|TRUE|157|Imposing the least aggregate sacrifice, he continued, is best achieved by imposing equal sacrifice on each taxpayer.
Procedural|0|0|FALSE|FALSE|TRUE|TRUE|FALSE|FALSE|393|Improvements in compliance are among the major yardsticks used by tax  authorities and their governments to assess their performance. 
Utilitarian|0|Utilitarian|FALSE|TRUE|FALSE|TRUE|FALSE|TRUE|585|In a particular social environment, some  systems of taxation may better foster participation in civil society. 
Deontological|Rawlsian|Rawlsian|FALSE|FALSE|TRUE|TRUE|FALSE|FALSE|441|In a society structured in accor­dance with the principles of natural liberty each person is consid­ered morally entitled to his natural talents and abilities and to whatever reward he is able to obtain through free exchange with others. Whatever distribution of income or other primary social goods results from a system of free exchange is necessarily just and the needs of the least advantaged are left to charity.
Libertarian|Libertarian|Libertarian|TRUE|TRUE|TRUE|TRUE|TRUE|TRUE|57|In a society which employs an income tax , distributive shares of income are determined by subtracting from gross income the amount of tax paid. An income tax is thus a part of society's dis­tributive mechanism and must be designed in accordance with the governing principles of social justice. 
Procedural|Rawlsian|0|FALSE|FALSE|FALSE|FALSE|FALSE|FALSE|84|In addition to special voting rules, it is also argued that substantive tax measures should be subject to direct constitutional constraints.
Procedural|Procedural|Procedural|TRUE|TRUE|TRUE|TRUE|TRUE|TRUE|491|In all these ventures, responsiveness to community concerns is a key feature of  effective taxpayer management. 
Procedural|Procedural|Procedural|TRUE|TRUE|TRUE|TRUE|TRUE|TRUE|76|In another recent debate, Walter Block again maintained that all state power should be regarded as illegitimate in view of the catastrophic losses that sadistic leaders of perverted states had inflicted on the helpless individuals over whom they rule. I also had a recent debate with Jeffrey Rogers Hummel, whose stated position was that the great advance of the nineteenth century was the elimination of chattel slavery, and that the great unmet social goal was the elimination of taxation, which was the equivalent of chattel slavery
Utilitarian|Utilitarian|0|TRUE|FALSE|FALSE|TRUE|FALSE|TRUE|535|In conclusion, Aristotle and Plato acknowledged social fulfillment to be a product of political  and economic equality. 
Deontological|Libertarian|Deontological|FALSE|TRUE|FALSE|TRUE|FALSE|TRUE|545|In fact, the rich should pay higher taxes because they  control much of the resources in the country. 
Libertarian|Libertarian|0|TRUE|FALSE|FALSE|TRUE|FALSE|TRUE|311|In granting citizens an entitlement to certain services or to a certain share of  âsocietyâsâ wealth, such principles in effect require that any time you labor, you must  labor in part for the purposes of the state or for the purposes of those who benefit  from the stateâs largesse because the state must redistribute part of the product of  your labor to meet those entitlements. 
Deontological|Procedural|0|FALSE|FALSE|FALSE|FALSE|FALSE|FALSE|35|In his essay Nozick explored the libertarian framework through the entitlement theory,  arguing that as people can be entitled to holdings of capital as well as to earnings, in a free  market based society they have the right to transfer those holdings to another person -in  which case the transferee becomes entitled to the property, and prima facie this is the only  valid method of transferral. 
Rawlsian|Rawlsian|0|TRUE|FALSE|FALSE|TRUE|FALSE|TRUE|191|In his opinion, progressiveness could only be  justified in the case of an increasing productivity of public services. 
Rawlsian|Rawlsian|0|TRUE|FALSE|FALSE|TRUE|FALSE|TRUE|357|In his opinion, the State should not tax  subsistence income because this will further depress the condition of the  poor and would result in higher costs for welfare expenditure. 
Procedural|Procedural|Procedural|TRUE|TRUE|TRUE|TRUE|TRUE|TRUE|73|In its economic context, libertarians believe that the market mechanism allows the  operation of free will by participants in the market. 
Utilitarian|Rawlsian|Utilitarian|FALSE|TRUE|FALSE|TRUE|FALSE|TRUE|143|In large part, the authors justify their position by invoking Pareto-optimality, actually  Pareto-superiority, that is, that a change is desirable if it makes some members of society  better off without making others worse off. 
Deontological|Rawlsian|0|FALSE|FALSE|FALSE|FALSE|FALSE|FALSE|475|In order for revenue-raising to serve its basic function, and to command widespread popular acceptance, it must be open to any reasonable view of good government. It follows, albeit along a twisty path, that the principles underlying the revenue function should give significant weight to pre-existing distributions of societal goods.
Libertarian|Libertarian|Libertarian|TRUE|TRUE|TRUE|TRUE|TRUE|TRUE|310|In order to achieve horizontal equity, the tax justice system must avoid arbitrary distinctions among similarly situated taxpayers on the basis of differences in status. 
Utilitarian|Utilitarian|Utilitarian|TRUE|TRUE|TRUE|TRUE|TRUE|TRUE|534|In other words, such principles entail that the  state and its beneficiaries have an entitlement or enforceable claim to and thus at least  a partial property right in your labor and therefore in you. 
Deontological|Deontological|Deontological|TRUE|TRUE|TRUE|TRUE|TRUE|TRUE|453|In return for taxes, taxpayers should not only  receive goods and services, but also sound governance that is respectful and  protective of democratic principles and processes. 
Rawlsian|0|Rawlsian|FALSE|TRUE|FALSE|TRUE|FALSE|TRUE|185|In societies where more emphasis is put on social justice (“all for one and one for all”) the rich will “naturally” pay higher taxes in order to make the structure flatter and more rounded and provide equality of access.
Deontological|Deontological|Deontological|TRUE|TRUE|TRUE|TRUE|TRUE|TRUE|347|In such a way,  given the distribution of wealth, progressive taxation allows the State to  collect the taxes required for the satisfaction of public needs at the  minimum cost for collectivity. 
Libertarian|Libertarian|Libertarian|TRUE|TRUE|TRUE|TRUE|TRUE|TRUE|358|In the broad sense, tax justice explores pro-poor and redistributive tax systems able to reduce income and social inequality. It involves a transparent process of pro-poor collection (those who have less, pay less) and pro-poor expenditure (those who have less, receive more), for instance, through public services
Rawlsian|Rawlsian|0|TRUE|FALSE|FALSE|TRUE|FALSE|TRUE|218|In the context of the tax transfer system, equity is usually considered under the two criteria  of vertical equity and horizontal equity. 
Rawlsian|Rawlsian|Rawlsian|TRUE|TRUE|TRUE|TRUE|TRUE|TRUE|542|In the first place, the taxing  authority should be able to arrange that two persons in the same  economic position pay the same sum and that a richer person pays  more than a poorer. 
Rawlsian|Rawlsian|Utilitarian|TRUE|FALSE|FALSE|TRUE|FALSE|TRUE|442|"In the late 1950s, Richard Musgrave wrote that ""[p]erhaps the most widely accepted principle of
equity in taxation is that people in equal positions should be treated equally.""' "
Rawlsian|Rawlsian|Rawlsian|TRUE|TRUE|TRUE|TRUE|TRUE|TRUE|299|In the modern world, taxation should be applied in a manner,  which the returns will benefit the citizens. 
Libertarian|Libertarian|Libertarian|TRUE|TRUE|TRUE|TRUE|TRUE|TRUE|473|In this case, however, it would  be easy to show that a much larger share may have to go to the upper  classes in order for the lower classes to maximize their economic expectations. 
Procedural|0|0|FALSE|FALSE|TRUE|TRUE|FALSE|FALSE|305|In this connection, the affluent should be paying higher taxes compared to the poor. 
Libertarian|Libertarian|Libertarian|TRUE|TRUE|TRUE|TRUE|TRUE|TRUE|36|In this context, the principle of ability to pay calls for progressive taxation. 
Deontological|Deontological|Deontological|TRUE|TRUE|TRUE|TRUE|TRUE|TRUE|249|In this system the distribution is based on talents but is qualified by the assumptionthat everyone has an equal opportunity to develop his talents regardless of social  position. 
Utilitarian|Rawlsian|Utilitarian|FALSE|TRUE|FALSE|TRUE|FALSE|TRUE|613|In this way, Rawls argues, the resulting  distribution will be just since it is determined by justly structured institutions. 
Procedural|Utilitarian|0|FALSE|FALSE|FALSE|FALSE|FALSE|FALSE|277|Increased compliance should boost the external integrity of the tax system, and the  external integrity of the tax system should encourage compliance. 
Procedural|0|0|FALSE|FALSE|TRUE|TRUE|FALSE|FALSE|513|"Indeed, in a subsequent  article, Dodge describes HE and VE as ""formal norms"" that ""equally-situated  persons should be treated equally"" and ""unequally-situated persons should be  taxed differently to an appropriate degree."" "
Deontological|Deontological|Deontological|TRUE|TRUE|TRUE|TRUE|TRUE|TRUE|25|Indeed, some trace the notion of HE as a fundamental tax principle to John Stuart Mill, who opined that a tax system ought to demand an equal tax burden from taxpayers with equal capacity to contribute.
Utilitarian|Utilitarian|Utilitarian|TRUE|TRUE|TRUE|TRUE|TRUE|TRUE|158|"Indeed, that is a basic tenet of welfarist tax policy: Tax should minimize the total ""excess
burden"" that taxation places on society."
Deontological|Deontological|Deontological|TRUE|TRUE|TRUE|TRUE|TRUE|TRUE|366|"Indeed, the principle ""no taxation without representation"" is not simply a principle of representative democracy, but was also a proscription in some early constitutions that conditioned the right to vote on the fact of being a taxpayer."
Libertarian|Libertarian|Libertarian|TRUE|TRUE|TRUE|TRUE|TRUE|TRUE|359|Individual equity emphasizes that we are entitled to the rewards of our efforts and from the trades and transactions that we make and thus is closely related to traditional market notions of efﬁciency.
Procedural|0|0|FALSE|FALSE|TRUE|TRUE|FALSE|FALSE|492|Inequalities in taxation that fail to benefit the most disadvantaged  may be outweighed by other economic arrangements and provisions  that benefit those who are worst-off.
Utilitarian|Utilitarian|Utilitarian|TRUE|TRUE|TRUE|TRUE|TRUE|TRUE|153|Insofar as individuals acquire (and retain) genuine property rights, all taxation is theft. 
Libertarian|Libertarian|0|TRUE|FALSE|FALSE|TRUE|FALSE|TRUE|65|Insofar as the master âtaxesâ away a portion of the product  of his labor, the slave has obviously been forced to work for purposes other than  his own, even though he has no property right in the product of his labor (the portion  of it he is allowed to eat also belongs to the master). 
Deontological|Libertarian|0|FALSE|FALSE|FALSE|FALSE|FALSE|FALSE|387|Instead of searching for a fair tax system, ethical behavior of the taxpayer  should be expected and set as a target. 
Utilitarian|Utilitarian|Utilitarian|TRUE|TRUE|TRUE|TRUE|TRUE|TRUE|170|Instead of talking about whether a tax change is progressive or not, the discussion should focus on whether the tax change has maximized total utility and, if not, how far the tax system is from its optimal structure. 
Utilitarian|Rawlsian|Utilitarian|FALSE|TRUE|FALSE|TRUE|FALSE|TRUE|477|Instead, the criterion  establishes a simple maximization rule: Maximize the welfare of the least well-off. 
Deontological|Deontological|Deontological|TRUE|TRUE|TRUE|TRUE|TRUE|TRUE|370|Integrity and compliance are most at risk of parting ways when a tax  authority seeks to improve compliance solely through making changes to the  administrative or legal infrastructure without regard to the sensibilities of citizens. 
Libertarian|Libertarian|Libertarian|TRUE|TRUE|TRUE|TRUE|TRUE|TRUE|382|Investment in  the human management system or taxpayer culture offers a further bonus to a tax  authority facing changes to the administrative and legal system. 
Deontological|Deontological|0|TRUE|FALSE|FALSE|TRUE|FALSE|TRUE|326|"ion. The utilitarian insistence on maximizing social welfare has its tax counterpart in a doctrine
 of ""minimal sacrifice"" according to which the tax policy most conducive to promoting overall welfare is the one that imposes a minimum burden on society"
Libertarian|Libertarian|Libertarian|TRUE|TRUE|TRUE|TRUE|TRUE|TRUE|649|"Irrespective of how desirable the goal of moderate equality may be, it is claimed, and notwithstanding the ability of a well-designed wealth transfer tax to accommodate the competing goods of economic efficiency, individual generosity, civic pluralism, and social solidarity, redistribution generally and transfer taxation specifically are inherently unjustified
on the grounds that they infringe individual liberties by violating private property rights.'"
Utilitarian|Utilitarian|Deontological|TRUE|FALSE|FALSE|TRUE|FALSE|TRUE|145|Is imposition of taxation tantamount to forced labour? 
Deontological|Deontological|0|TRUE|FALSE|FALSE|TRUE|FALSE|TRUE|18|It also assumes that in a collectivized system for the general good, all  work in economic harmony. 
Deontological|Deontological|Deontological|TRUE|TRUE|TRUE|TRUE|TRUE|TRUE|537|It being by him removed from the common state nature placed  it in, hath by this labour something annexed to it that excludes the common right of  other men. 
Libertarian|Libertarian|Libertarian|TRUE|TRUE|TRUE|TRUE|TRUE|TRUE|401|It could even depress the prospects of the worst-off group, if the system  failed to include sufficient redistribution or investment. 
Utilitarian|Utilitarian|Deontological|TRUE|FALSE|FALSE|TRUE|FALSE|TRUE|148|It follows that a just  distribution might obtain in a society that is not just. 
Deontological|Deontological|Deontological|TRUE|TRUE|TRUE|TRUE|TRUE|TRUE|12|It is a  plan for a simpler, fairer, and more economically rational tax. 
Libertarian|Libertarian|Libertarian|TRUE|TRUE|TRUE|TRUE|TRUE|TRUE|355|It is acceptable to improve the prospects of those better-off as well, as  long as the prospects of the worst-off are made better. 
Rawlsian|Rawlsian|Rawlsian|TRUE|TRUE|TRUE|TRUE|TRUE|TRUE|134|It is commonly assumed that a  person with a large income is better able to pay than a person with a small or moderate  income. 
Rawlsian|Rawlsian|Rawlsian|TRUE|TRUE|TRUE|TRUE|TRUE|TRUE|364|It is important for economic efficiency that  the tax applied to any given firm have a single rate. 
Utilitarian|0|Utilitarian|FALSE|TRUE|FALSE|TRUE|FALSE|TRUE|603|"It is just this mind set that accounts for Robert Nozick's familiar line that taxation is not only theft but also a form of forced labor, or at least ""on a par"" with it."
Procedural|Procedural|Procedural|TRUE|TRUE|TRUE|TRUE|TRUE|TRUE|77|It is not quite the same as the general claim that taxation  interferes with individual liberty insofar as its enforcement is intrusive and it prevents  one from doing what he wants with a portion of his income,2 for there are many who  would find such infringements of liberty acceptable but nevertheless consider uncomfortable  the notion that taxation also amounts to forcing people to work. 
Procedural|Procedural|Procedural|TRUE|TRUE|TRUE|TRUE|TRUE|TRUE|95|It is on the basis of this  assumption that the model advocates stricter audit and heavy penalties for offenders as a basis for reducing non-compliance. 
Libertarian|Libertarian|0|TRUE|FALSE|FALSE|TRUE|FALSE|TRUE|398|It is only by an escape from the focus on the individual, and recognition  of taxation as a tool of the collectivity, that progressivity in  taxation properly may be regarded as fair and in accordance with  principles of justice. 
Deontological|Deontological|Deontological|TRUE|TRUE|TRUE|TRUE|TRUE|TRUE|482|It is only in this way, I believe, that the problem of distribution can be handled  as a case of pure procedural justice. 
Utilitarian|Utilitarian|Utilitarian|TRUE|TRUE|TRUE|TRUE|TRUE|TRUE|167|It is relatively easy to generalize about fundamental tax reform:  Simplify the law, make it fair, and stimulate economic growth. 
Utilitarian|Utilitarian|Utilitarian|TRUE|TRUE|TRUE|TRUE|TRUE|TRUE|579|It is the careful balance among its provisions that improvements administratively workable and politically D. The Defiat  The Fair Tax was designed to replace, in its first year, the same revenue raised by the current tax system. 
Rawlsian|Rawlsian|Rawlsian|TRUE|TRUE|TRUE|TRUE|TRUE|TRUE|136|It is therefore hypothesized that those who believe that there are disparities  in who is paying their fair share will also believe that these disparities are mirrored  in the procedures and processes adopted by the tax office to collect the revenue (the  procedural justice hypothesis). 
Rawlsian|Rawlsian|0|TRUE|FALSE|FALSE|TRUE|FALSE|TRUE|315|It makes intuitive sense that one would want to tax saving, in the spirit  of redistribution and fairness, when the yield to capital allows individuals  to live better, in material terms: the case of upward shifts. 
Rawlsian|Libertarian|Utilitarian|FALSE|FALSE|FALSE|FALSE|FALSE|FALSE|111|It may be the case that states have a right to impose institutions even if they are not fully just. 
Deontological|Rawlsian|0|FALSE|FALSE|FALSE|FALSE|FALSE|FALSE|470|It might be assumed, in financing  particular services, that an equal cost was incurred in servicing every  taxpayer. 
Deontological|Deontological|0|TRUE|FALSE|FALSE|TRUE|FALSE|TRUE|8|It must tax as if all  citizens were alike in such respects. 
Libertarian|Libertarian|0|TRUE|FALSE|FALSE|TRUE|FALSE|TRUE|324|It redefined tax fairness in nonutilitarian  terms, where taxation is one of the institutional structures of  society designed to guarantee equal concern and respect for each individual. 
Libertarian|Libertarian|Libertarian|TRUE|TRUE|TRUE|TRUE|TRUE|TRUE|472|It seems to me that the logic of the difference principle would lead to the imposition of a steeper and steeper progressive tax with redistribution of the monies generated to those at the bottom until the process reached the point at which steeper progressivity became counterproductive, in the sense of leaving less money to redistribute than a less progressive tax because of its negative effect on incentives
Deontological|Deontological|Deontological|TRUE|TRUE|TRUE|TRUE|TRUE|TRUE|449|It then applies a single rate to all labor income above this level. 
Rawlsian|Rawlsian|Utilitarian|TRUE|FALSE|FALSE|TRUE|FALSE|TRUE|115|Its purpose is to investigate the extent to which the  Australian community believes that their tax authority is pursuing one of its goals,  collecting revenue, in a sound and purposeful way. 
Deontological|Deontological|Deontological|TRUE|TRUE|TRUE|TRUE|TRUE|TRUE|250|"James maintains that international trade harms individuals and is unjust if the ""injured person's life prospects would have been better under autarky, in which case he or she is made worse off, over- all, for life in an open society. "
Rawlsian|Rawlsian|Rawlsian|TRUE|TRUE|TRUE|TRUE|TRUE|TRUE|288|Just as invoking  specific substantive controls on the tax raising power of government limits governmental  discretion and so provides insurance against exploitation, so specifying the nature of the  political process (votingsystems, frequency of elections, term limits, etc.) 
Libertarian|Libertarian|0|TRUE|FALSE|FALSE|TRUE|FALSE|TRUE|206|Just as it can build cohesion in the community, it can  provide a basis for unity in a tax authority as difficult trade-offs are made redesigning  the legal and administrative system. 
Rawlsian|Rawlsian|Rawlsian|TRUE|TRUE|TRUE|TRUE|TRUE|TRUE|376|Justice and logic, however, dictate that  our method of raising revenue be fair, efficient, certain, and administered in a  manner that promotes the health of the economy. 
Deontological|Deontological|Deontological|TRUE|TRUE|TRUE|TRUE|TRUE|TRUE|28|"Knut Wicksell, for example, argued that unanimity on combined tax and spending decisions was
“the only certain and palpable guarantee against injustice in tax distribution,”"
Rawlsian|Rawlsian|Rawlsian|TRUE|TRUE|TRUE|TRUE|TRUE|TRUE|243|Let us  call this full self-ownership.3  While this version of libertarianism may be the most distinctive,  and is definitely the most often discussed and attacked, few libertarians actually hold this  position. 
Deontological|Deontological|Deontological|TRUE|TRUE|TRUE|TRUE|TRUE|TRUE|215|Libertarians see  individuals as sovereign, as people who have a right to control their bodies and work,  who are free to decide how to interact with willing others, and who cannot be forced to  do things against their will without very strong justification. 
Libertarian|Libertarian|Rawlsian|TRUE|FALSE|FALSE|TRUE|FALSE|TRUE|242|ligious contexts. As far as this value is concerned, therefore, it would seem that the best tax is no tax at all.
Procedural|Procedural|0|TRUE|FALSE|FALSE|TRUE|FALSE|TRUE|251|Locke makes the famous statement that:  every man has a property in his own person; this nobody has any right to but himself. 
Libertarian|Libertarian|Libertarian|TRUE|TRUE|TRUE|TRUE|TRUE|TRUE|341|Looking at wages, or the payment for labor, taxes on  them cause after-tax wages to fall, and so people find work less attractive. 
Libertarian|Libertarian|Libertarian|TRUE|TRUE|TRUE|TRUE|TRUE|TRUE|230|Many of the needs of development, such as building institutions  and basic infrastructure, providing adequate education and social security  and alleviating poverty are formidable objectives that require public resources. 
Libertarian|Libertarian|Libertarian|TRUE|TRUE|TRUE|TRUE|TRUE|TRUE|210|Many of the problems and tradeoffs created by fundamental tax  reform could be mitigated if reform boosted growth dramatically. 
Procedural|0|0|FALSE|FALSE|TRUE|TRUE|FALSE|FALSE|416|Marriage neutrality would be the equal taxation of incomes regardless of marital status. 
Utilitarian|Utilitarian|Utilitarian|TRUE|TRUE|TRUE|TRUE|TRUE|TRUE|156|Max burdens should bear similarly upon persons whom we regard as in substantially similar circumstances, and differently where circumstances differ.
Utilitarian|Utilitarian|0|TRUE|FALSE|FALSE|TRUE|FALSE|TRUE|445|Meaningful tax reform requires a transparent process in which informed citizens, and not just Wall Street titans and business lobbyists, have input on legislation that affects the tax code and revenue received by the Treasury. 
Utilitarian|Utilitarian|Utilitarian|TRUE|TRUE|TRUE|TRUE|TRUE|TRUE|601|More capital also means the  economy will have more productive assets, which also contributes to  more production. 
Utilitarian|Utilitarian|Utilitarian|TRUE|TRUE|TRUE|TRUE|TRUE|TRUE|150|Moreover, any tax is inevitably the  product of give and take between various interests and branches of government motivated  by a self-interest that is not typically consonant with principles of societal justice. 
Deontological|0|0|FALSE|FALSE|TRUE|TRUE|FALSE|FALSE|593|Moreover, in a democracy the person has a vote, at least indirectly, in  determining the government's tax system. 
Utilitarian|Utilitarian|Utilitarian|TRUE|TRUE|TRUE|TRUE|TRUE|TRUE|169|Moreover, income tax was believed to foster  the development of democratic values in society. 
Deontological|Utilitarian|Deontological|FALSE|TRUE|FALSE|TRUE|FALSE|TRUE|640|Moreover, it seems prima facie implausible  to suppose that the state should be, and inevitably any society in which it is  rightful owner of everything would be a totalitarian one, as no doubt even Nozickâs  critics would acknowledge.4   If they do acknowledge it, their objection to Nozickâs argument can have no  force, for although that argument does presuppose that the state does not own all  property, that is all it presupposes by way of a theory of property rights. 
Rawlsian|Rawlsian|Rawlsian|TRUE|TRUE|TRUE|TRUE|TRUE|TRUE|117|Most libertarians, that is, endorse a conception of self-ownership that is weakened  along one or several dimensions in order to avoid these objections. 
Libertarian|Libertarian|Libertarian|TRUE|TRUE|TRUE|TRUE|TRUE|TRUE|377|"Musgrave describes the legacy of ""ability to pay"" taxation as, ""[a] general index of economic wellbeing  which broadly measures a person's capacity to contribute or to 'sacrifice' on behalf of government."" "
Procedural|Procedural|0|TRUE|FALSE|FALSE|TRUE|FALSE|TRUE|485|"No measure should be carried out unless it have the prior unanimous or at any  rate overwhelming support of the whole people."" "
